{"schemaVersion":1,"moduleId":"cdeadmin.migration","specVersion":"1.0","committedFirstParty":true,"assetTypes":["cdeadmin.migration.v1"],"surfaces":[{"id":"migration_portfolio","title":"Migration Portfolio","description":"All migration projects and phase/status."},{"id":"assessment","title":"Assessment","description":"Compatibility matrix and blockers."},{"id":"mapping_designer","title":"Mapping Designer","description":"Object/type/name/transformation mappings."},{"id":"schema_plan","title":"Schema Plan","description":"Embedded Schema Comparison plan and ordered operations."},{"id":"data_movement","title":"Data Movement","description":"Copy streams, partitions and throughput."},{"id":"validation","title":"Validation","description":"Counts/hashes/quality/query-result verification."},{"id":"cutover_runbook","title":"Cutover Runbook","description":"Gated operational checklist."},{"id":"run_monitor","title":"Run Monitor","description":"Task graph, lag, throughput, errors and recovery."}],"commands":[{"id":"migration.project.create","requiresCommandRegistry":true},{"id":"migration.assess.run","requiresCommandRegistry":true},{"id":"migration.mapping.accept","requiresCommandRegistry":true},{"id":"migration.plan.validate","requiresCommandRegistry":true},{"id":"migration.dry_run","requiresCommandRegistry":true},{"id":"migration.copy.start","requiresCommandRegistry":true},{"id":"migration.cutover.arm","requiresCommandRegistry":true},{"id":"migration.cutover.execute","requiresCommandRegistry":true},{"id":"migration.rollback.execute","requiresCommandRegistry":true},{"id":"migration.verify.run","requiresCommandRegistry":true}],"taskTypes":["migration.assessment","migration.schema.apply","migration.data.copy","migration.validation","migration.cutover","migration.rollback"],"events":["migration.assessment.completed","migration.phase.changed","migration.cutover.ready","migration.validation.failed","migration.completed"],"primaryPlate":"svg/03_migration_workspace.svg","ui":{"leftDefaultPx":288,"inspectorDefaultPx":340,"bottomDefaultPx":240,"toolbarStandardPx":34,"statusStandardPx":24,"baseGridPx":4},"rules":{"secretsInAssets":false,"directProviderMutationFromDragDrop":false,"providerSupportMayBeInferred":false,"specGapOnUndefinedChoice":true}}
