{"schemaVersion":1,"moduleId":"cdeadmin.quality","specVersion":"1.0","committedFirstParty":true,"assetTypes":["cdeadmin.quality.v1"],"surfaces":[{"id":"quality_overview","title":"Quality Overview","description":"Coverage, recent runs, critical failures and trends."},{"id":"rule_set_designer","title":"Rule Set Designer","description":"Searchable rule library + typed parameter Inspector."},{"id":"data_scope_slice_designer","title":"Data Scope / Slice Designer","description":"Resource, partition, filter and sampling selection."},{"id":"validation_run_results","title":"Validation Run Results","description":"Rule grid, metrics, failed samples, diagnostics."},{"id":"profiler","title":"Profiler","description":"Profile a bounded data sample and propose draft rules."},{"id":"quality_history","title":"Quality History","description":"Trend charts and baseline comparisons."},{"id":"schedule_actions","title":"Schedule & Actions","description":"Production checkpoint behavior."}],"commands":[{"id":"quality.ruleset.create","requiresCommandRegistry":true},{"id":"quality.rule.add","requiresCommandRegistry":true},{"id":"quality.rule.test","requiresCommandRegistry":true},{"id":"quality.ruleset.run","requiresCommandRegistry":true},{"id":"quality.run.cancel","requiresCommandRegistry":true},{"id":"quality.baseline.capture","requiresCommandRegistry":true},{"id":"quality.profile.run","requiresCommandRegistry":true},{"id":"quality.result.export","requiresCommandRegistry":true},{"id":"quality.contract.sync","requiresCommandRegistry":true}],"taskTypes":["quality.validation.run","quality.profile.run","quality.baseline.capture"],"events":["quality.run.started","quality.rule.failed","quality.run.completed","quality.baseline.changed"],"primaryPlate":"svg/02_quality_workspace.svg","ui":{"leftDefaultPx":288,"inspectorDefaultPx":340,"bottomDefaultPx":240,"toolbarStandardPx":34,"statusStandardPx":24,"baseGridPx":4},"rules":{"secretsInAssets":false,"directProviderMutationFromDragDrop":false,"providerSupportMayBeInferred":false,"specGapOnUndefinedChoice":true}}
