{"schemaVersion":1,"moduleId":"cdeadmin.contract","specVersion":"1.0","committedFirstParty":true,"assetTypes":["cdeadmin.contract.v1"],"surfaces":[{"id":"contract_explorer","title":"Contract Explorer","description":"Project contracts by domain/status."},{"id":"contract_editor","title":"Contract Editor","description":"Outline + section editor."},{"id":"schema_resource_binding","title":"Schema & Resource Binding","description":"Logical contract elements mapped to live resources."},{"id":"quality_sla","title":"Quality & SLA","description":"Rule obligations and service-level definitions."},{"id":"team_roles_support","title":"Team / Roles / Support","description":"Ownership and access expectations."},{"id":"compliance","title":"Compliance","description":"Live validation and drift."},{"id":"version_diff","title":"Version Diff","description":"Contract version comparison."}],"commands":[{"id":"contract.create","requiresCommandRegistry":true},{"id":"contract.import.odcs","requiresCommandRegistry":true},{"id":"contract.validate","requiresCommandRegistry":true},{"id":"contract.bind_resource","requiresCommandRegistry":true},{"id":"contract.sync_metadata","requiresCommandRegistry":true},{"id":"contract.compliance.run","requiresCommandRegistry":true},{"id":"contract.version.create","requiresCommandRegistry":true},{"id":"contract.status.set","requiresCommandRegistry":true},{"id":"contract.export.odcs","requiresCommandRegistry":true}],"taskTypes":["contract.import","contract.compliance.validation","contract.metadata.compare"],"events":["contract.changed","contract.activated","contract.compliance.failed","contract.drift.detected"],"primaryPlate":"svg/06_contract_workspace.svg","ui":{"leftDefaultPx":288,"inspectorDefaultPx":340,"bottomDefaultPx":240,"toolbarStandardPx":34,"statusStandardPx":24,"baseGridPx":4},"rules":{"secretsInAssets":false,"directProviderMutationFromDragDrop":false,"providerSupportMayBeInferred":false,"specGapOnUndefinedChoice":true}}
